{
  "id": "fb-001",
  "reportId": "report-empty",
  "origin": {
    "host": "unknown",
    "projectFingerprint": "0000000000000000000000000000000000000000000000000000000000000000",
    "reportId": "report-empty",
    "bindingMode": "unbound",
    "createdAt": "2026-01-01T00:00:00.000Z"
  },
  "items": [
    {
      "id": "item-001",
      "threadId": "thread-001",
      "anchor": {
        "type": "change",
        "ref": "change-001",
        "fingerprint": "0000000000000000000000000000000000000000000000000000000000000000"
      },
      "sourceMessageId": "message-001",
      "requestKind": "explain",
      "question": "Why did this change?",
      "contextSelection": {
        "includeCodeDiff": true,
        "includeVisualCrop": false,
        "includeComputedStyle": false,
        "includeDomAria": false,
        "includeRelatedTests": false
      },
      "state": "ready"
    }
  ],
  "state": "ready",
  "deliveryMode": "export-only",
  "contextHash": "0000000000000000000000000000000000000000000000000000000000000000",
  "createdAt": "2026-01-01T00:00:00.000Z"
}
